### ISSUE TITLE
envoy on VM/debian missing read event or buffering the first packet from service

### ISSUE THREAD

**Issue by ldemailly** [istio/proxy#588]
tcp service on 3306 (mysql, but we'll use nc as simulator/highlighting the issue)
server side :
(echo THIS_IS_ME; sleep 20; echo PACKET_2) |nc -v -l -p 3306

client side:
nc -v mysqldb.vm.svc.cluster.local 3306

Expected:
THIS_IS_ME
followed several seconds later by
PACKET_2

Actual:
nothing for several seconds then
```
21:55:17.949641 IP 10.63.252.229.mysql > demo-vm-1.c.istio-demo-0-2.internal.36860: Flags [P.], seq 1:21, ack 1, win 342, options [nop,nop,TS val 2303223680 ecr 2526121684], length 20
THIS_IS_ME
PACKET_2
	0x0000:  4500 0048 e4e7 4000 4006 4409 0a3f fce5  E..H..@.@.D..?..
	0x0020:  8018 00f3 0d60 0000 0101 080a 026a 4845  .....`.......jHE
	0x0010:  0a96 0005 0cea 8ffc 626d 884d 45ac 2c67  ........bm.ME.,g
	0x0030:  a502 3246 1703 0300 2c00 0000 0000 0000  ..2F....,.......
	0x0020:  8018 0156 11fa 0000 0101 080a 8948 6780  ...V.........Hg.
	0x0030:  9691 8ed4 5448 4953 5f49 535f 4d45 0a50  ....THIS_IS_ME.P
	0x0040:  4143 4b45 545f 320a                      ACKET_2.
	0x0040:  01c2 4495 5540 f7ce 8366 d535 8a7a 0210  ..D.U@...f.5.z..
	0x0050:  92ae 1f65 0614 d89a 6e1e d46c f783 9a2b  ...e....n..l...+
	0x0060:  58be 7637 4a                             X.v7J
```

Server side:
```
connect to [127.0.0.1] from localhost [127.0.0.1] 44780
21:55:03.796335 IP localhost.mysql > localhost.44780: Flags [P.], seq 1:12, ack 1, win 342, options [nop,nop,TS val 40516211 ecr 40516211], length 11
	0x0000:  4500 003f e5bd 4000 4006 56f9 7f00 0001  E..?..@.@.V.....
	0x0010:  7f00 0001 0cea aeec e46f dfce be6e cef5  .........o...n..
	0x0020:  8018 0156 fe33 0000 0101 080a 026a 3a73  ...V.3.......j:s
	0x0030:  026a 3a73 5448 4953 5f49 535f 4d45 0a    .j:sTHIS_IS_ME.
[...]
21:55:17.948833 IP localhost.mysql > localhost.44780: Flags [P.], seq 12:21, ack 1, win 342, options [nop,nop,TS val 40519749 ecr 40516211], length 9
	0x0030:  026a 3a73 5041 434b 4554 5f32 0a         .j:sPACKET_2.
```

this is with TLS and Mixer (both work; just maybe participate in delaying the first packet)

End user effect: mysql doesn't work because the client waits for the server's first packet and the server waits for the client (ditto for any protocol where the server starts chatting righaway (eg sendmail etc))

**Comment by ldemailly** [comment]
this was with
https://storage.googleapis.com/istio-artifacts/proxy/67851b9648346112987cb1ccf79a30b912724475/artifacts/debs/istio-proxy.deb

```
demailly@mysqldb-vm-1:~$ ls -lh /usr/local/bin/envoy
-rwxr-xr-x 1 root root 27M Jan  1  1970 /usr/local/bin/envoy
ldemailly@mysqldb-vm-1:~$ shasum istio-proxy.deb 
a04033a361dce6cdf3daa6ba293feafc0ebce456  istio-proxy.deb
```

**Comment by ldemailly** [comment]
this is on
Linux mysqldb-vm-1 4.9.0-3-amd64 #1 SMP Debian 4.9.30-2+deb9u3 (2017-08-06) x86_64 GNU/Linux

**Comment by ldemailly** [comment]
@costinm any chance our VM iptables cause this (some difference compared to what happens in pod)

**Comment by qiwzhang** [comment]
I don't think the problem is in Envoy tcp_proxy filter.  I connected two Envoy tcp-proxy,  could not re-produce the problem. 

  port:6060  is a Envoy tcp-proxy  ==>  port:16060  is another Envoy tcp-proxy  ==>  port 8080

(echo THIS_IS_ME; sleep 20; echo PACKET_2) |nc -v -l -p  8080

nc -v localhost 6060
Connection to localhost 6060 port [tcp/*] succeeded!
THIS_IS_ME

Paused for 20s, then got

PACKET_2

**Comment by ldemailly** [comment]
Thanks for trying to repro, can you add mixer and TLS to your setup?

**Comment by lizan** [comment]
@ldemailly I'm suspecting that is possible with TLS buffer left in server side, do you have trace level log from each side envoys?

**Comment by ldemailly** [comment]
I don't have traces because it becomes a flood with pilot calls

note: after reboot and using the same debug binary as in k8s I got 1 time without delay

so if you are reproducing try more than once

**Comment by ldemailly** [comment]
same on
```
ldemailly@instance-1:~$ uname -a
Linux instance-1 4.10.0-37-generic #41~16.04.1-Ubuntu SMP Fri Oct 6 22:42:59 UTC 2017 x86_64 x86_64 x86_64 GNU/Linux
ldemailly@instance-1:~$ cat /etc/issue
Ubuntu 16.04.3 LTS \n \l
```
fresh new instance

cc @PiotrSikora - I would really love some help here, I'm flying in 4h and kinda have nothing working because of thi

**Comment by ldemailly** [comment]
without auth, the nc example works as expected (but mysql still doesn't)

full tcp dump (eth and lo) of working case with socat instead of envoy:
```
$ socat TCP4-LISTEN:3307 TCP4:localhost:3306




16:53:24.218619 IP demo-vm-1.c.istio-demo-0-2.internal.33684 > instance-1.c.istio-demo-0-2.internal.3307: Flags [S], seq 1850766867, win 28400, options [mss 1420,sackOK,TS val 1223657110 ecr 0,nop,wscale 7], length 0
	0x0000:  4500 003c 8e5e 4000 4006 9722 0a96 0005  E..<.^@.@.."....
	0x0010:  0a96 000b 8394 0ceb 6e50 7613 0000 0000  ........nPv.....
	0x0020:  a002 6ef0 7f93 0000 0204 058c 0402 080a  ..n.............
	0x0030:  48ef 8696 0000 0000 0103 0307            H...........
16:53:24.218847 IP instance-1.c.istio-demo-0-2.internal.3307 > demo-vm-1.c.istio-demo-0-2.internal.33684: Flags [S.], seq 309957138, ack 1850766868, win 28160, options [mss 1420,sackOK,TS val 3430511538 ecr 1223657110,nop,wscale 7], length 0
	0x0000:  4500 003c 0000 4000 4006 2581 0a96 000b  E..<..@.@.%.....
	0x0010:  0a96 0005 0ceb 8394 1279 9212 6e50 7614  .........y..nPv.
	0x0020:  a012 6e00 156a 0000 0204 058c 0402 080a  ..n..j..........
	0x0030:  cc79 73b2 48ef 8696 0103 0307            .ys.H.......
16:53:24.219576 IP demo-vm-1.c.istio-demo-0-2.internal.33684 > instance-1.c.istio-demo-0-2.internal.3307: Flags [.], ack 1, win 222, options [nop,nop,TS val 1223657110 ecr 3430511538], length 0
	0x0000:  4500 0034 8e5f 4000 4006 9729 0a96 0005  E..4._@.@..)....
	0x0010:  0a96 000b 8394 0ceb 6e50 7614 1279 9213  ........nPv..y..
	0x0020:  8010 00de 3781 0000 0101 080a 48ef 8696  ....7.......H...
	0x0030:  cc79 73b2                                .ys.
16:53:24.222040 IP localhost.38668 > localhost.mysql: Flags [S], seq 3006768334, win 43690, options [mss 65495,sackOK,TS val 3068920919 ecr 0,nop,wscale 7], length 0
	0x0000:  4500 003c fc31 4000 4006 4088 7f00 0001  E..<.1@.@.@.....
	0x0010:  7f00 0001 970c 0cea b337 a4ce 0000 0000  .........7......
	0x0020:  a002 aaaa fe30 0000 0204 ffd7 0402 080a  .....0..........
	0x0030:  b6ec 0457 0000 0000 0103 0307            ...W........
16:53:24.222104 IP localhost.mysql > localhost.38668: Flags [S.], seq 1626554282, ack 3006768335, win 43690, options [mss 65495,sackOK,TS val 3068920919 ecr 3068920919,nop,wscale 7], length 0
	0x0000:  4500 003c 0000 4000 4006 3cba 7f00 0001  E..<..@.@.<.....
	0x0010:  7f00 0001 0cea 970c 60f3 3faa b337 a4cf  ........`.?..7..
	0x0020:  a012 aaaa fe30 0000 0204 ffd7 0402 080a  .....0..........
	0x0030:  b6ec 0457 b6ec 0457 0103 0307            ...W...W....
16:53:24.222153 IP localhost.38668 > localhost.mysql: Flags [.], ack 1, win 342, options [nop,nop,TS val 3068920919 ecr 3068920919], length 0
	0x0000:  4500 0034 fc32 4000 4006 408f 7f00 0001  E..4.2@.@.@.....
	0x0010:  7f00 0001 970c 0cea b337 a4cf 60f3 3fab  .........7..`.?.
	0x0020:  8010 0156 fe28 0000 0101 080a b6ec 0457  ...V.(.........W
	0x0030:  b6ec 0457                                ...W
16:53:24.223099 IP localhost.38668 > localhost.mysql: Flags [.], ack 111, win 342, options [nop,nop,TS val 3068920919 ecr 3068920919], length 0
	0x0000:  4500 0034 fc33 4000 4006 408e 7f00 0001  E..4.3@.@.@.....
	0x0010:  7f00 0001 970c 0cea b337 a4cf 60f3 4019  .........7..`.@.
	0x0020:  8010 0156 fe28 0000 0101 080a b6ec 0457  ...V.(.........W
	0x0030:  b6ec 0457                                ...W
16:53:24.223273 IP instance-1.c.istio-demo-0-2.internal.3307 > demo-vm-1.c.istio-demo-0-2.internal.33684: Flags [P.], seq 1:111, ack 1, win 220, options [nop,nop,TS val 3430511539 ecr 1223657110], length 110
	0x0000:  4500 00a2 caed 4000 4006 5a2d 0a96 000b  E.....@.@.Z-....
	0x0010:  0a96 0005 0ceb 8394 1279 9213 6e50 7614  .........y..nPv.
	0x0020:  8018 00dc 15d0 0000 0101 080a cc79 73b3  .............ys.
	0x0030:  48ef 8696 6a00 0000 0a35 2e35 2e35 2d31  H...j....5.5.5-1
	0x0040:  302e 302e 3331 2d4d 6172 6961 4442 2d30  0.0.31-MariaDB-0
	0x0050:  7562 756e 7475 302e 3136 2e30 342e 3200  ubuntu0.16.04.2.
	0x0060:  1200 0000 2d4d 7e55 6b3b 233e 00ff f72d  ....-M~Uk;#>...-
	0x0070:  0200 3fa0 1500 0000 0000 0000 0000 004b  ..?............K
	0x0080:  4245 753f 7861 5b25 456a 6700 6d79 7371  BEu?xa[%Ejg.mysq
	0x0090:  6c5f 6e61 7469 7665 5f70 6173 7377 6f72  l_native_passwor
	0x00a0:  6400                                     d.
16:53:24.223444 IP demo-vm-1.c.istio-demo-0-2.internal.33684 > instance-1.c.istio-demo-0-2.internal.3307: Flags [.], ack 111, win 222, options [nop,nop,TS val 1223657111 ecr 3430511539], length 0
	0x0000:  4508 0034 8e60 4000 4006 9720 0a96 0005  E..4.`@.@.......
	0x0010:  0a96 000b 8394 0ceb 6e50 7614 1279 9281  ........nPv..y..
	0x0020:  8010 00de 3711 0000 0101 080a 48ef 8697  ....7.......H...
	0x0030:  cc79 73b3                                .ys.
16:53:24.224533 IP demo-vm-1.c.istio-demo-0-2.internal.33684 > instance-1.c.istio-demo-0-2.internal.3307: Flags [P.], seq 1:205, ack 111, win 222, options [nop,nop,TS val 1223657112 ecr 3430511539], length 204
	0x0000:  4508 0100 8e61 4000 4006 9653 0a96 0005  E....a@.@..S....
	0x0010:  0a96 000b 8394 0ceb 6e50 7614 1279 9281  ........nPv..y..
	0x0020:  8018 00de f532 0000 0101 080a 48ef 8698  .....2......H...
	0x0030:  cc79 73b3 c800 0001 8da2 3f00 0000 0001  .ys.......?.....
	0x0040:  2d00 0000 0000 0000 0000 0000 0000 0000  -...............
	0x0050:  0000 0000 0000 0000 726f 6f74 0014 aeb2  ........root....
	0x0060:  fa7c 201f 533e f4e6 f59f 238e ee26 563c  .|..S>....#..&V<
	0x0070:  f451 7465 7374 006d 7973 716c 5f6e 6174  .Qtest.mysql_nat
	0x0080:  6976 655f 7061 7373 776f 7264 0072 035f  ive_password.r._
	0x0090:  6f73 1064 6562 6961 6e2d 6c69 6e75 782d  os.debian-linux-
	0x00a0:  676e 750c 5f63 6c69 656e 745f 6e61 6d65  gnu._client_name
	0x00b0:  086c 6962 6d79 7371 6c04 5f70 6964 0532  .libmysql._pid.2
	0x00c0:  3432 3832 0f5f 636c 6965 6e74 5f76 6572  4282._client_ver
	0x00d0:  7369 6f6e 0731 302e 302e 3331 095f 706c  sion.10.0.31._pl
	0x00e0:  6174 666f 726d 0678 3836 5f36 340c 7072  atform.x86_64.pr
	0x00f0:  6f67 7261 6d5f 6e61 6d65 056d 7973 716c  ogram_name.mysql
16:53:24.224569 IP instance-1.c.istio-demo-0-2.internal.3307 > demo-vm-1.c.istio-demo-0-2.internal.33684: Flags [.], ack 205, win 229, options [nop,nop,TS val 3430511540 ecr 1223657112], length 0
	0x0000:  4500 0034 caee 4000 4006 5a9a 0a96 000b  E..4..@.@.Z.....
	0x0010:  0a96 0005 0ceb 8394 1279 9281 6e50 76e0  .........y..nPv.
	0x0020:  8010 00e5 1562 0000 0101 080a cc79 73b4  .....b.......ys.
	0x0030:  48ef 8698                                H...
16:53:24.225130 IP localhost.38668 > localhost.mysql: Flags [P.], seq 1:205, ack 111, win 342, options [nop,nop,TS val 3068920920 ecr 3068920919], length 204
	0x0000:  4500 0100 fc34 4000 4006 3fc1 7f00 0001  E....4@.@.?.....
	0x0010:  7f00 0001 970c 0cea b337 a4cf 60f3 4019  .........7..`.@.
	0x0020:  8018 0156 fef4 0000 0101 080a b6ec 0458  ...V...........X
	0x0030:  b6ec 0457 c800 0001 8da2 3f00 0000 0001  ...W......?.....
	0x0040:  2d00 0000 0000 0000 0000 0000 0000 0000  -...............
	0x0050:  0000 0000 0000 0000 726f 6f74 0014 aeb2  ........root....
	0x0060:  fa7c 201f 533e f4e6 f59f 238e ee26 563c  .|..S>....#..&V<
	0x0070:  f451 7465 7374 006d 7973 716c 5f6e 6174  .Qtest.mysql_nat
	0x0080:  6976 655f 7061 7373 776f 7264 0072 035f  ive_password.r._
	0x0090:  6f73 1064 6562 6961 6e2d 6c69 6e75 782d  os.debian-linux-
	0x00a0:  676e 750c 5f63 6c69 656e 745f 6e61 6d65  gnu._client_name
	0x00b0:  086c 6962 6d79 7371 6c04 5f70 6964 0532  .libmysql._pid.2
	0x00c0:  3432 3832 0f5f 636c 6965 6e74 5f76 6572  4282._client_ver
	0x00d0:  7369 6f6e 0731 302e 302e 3331 095f 706c  sion.10.0.31._pl
	0x00e0:  6174 666f 726d 0678 3836 5f36 340c 7072  atform.x86_64.pr
	0x00f0:  6f67 7261 6d5f 6e61 6d65 056d 7973 716c  ogram_name.mysql
16:53:24.225142 IP localhost.mysql > localhost.38668: Flags [.], ack 205, win 350, options [nop,nop,TS val 3068920920 ecr 3068920920], length 0
	0x0000:  4508 0034 6755 4000 4006 d564 7f00 0001  E..4gU@.@..d....
	0x0010:  7f00 0001 0cea 970c 60f3 4019 b337 a59b  ........`.@..7..
	0x0020:  8010 015e fe28 0000 0101 080a b6ec 0458  ...^.(.........X
	0x0030:  b6ec 0458                                ...X
16:53:24.225401 IP localhost.mysql > localhost.38668: Flags [P.], seq 111:122, ack 205, win 350, options [nop,nop,TS val 3068920920 ecr 3068920920], length 11
	0x0000:  4508 003f 6756 4000 4006 d558 7f00 0001  E..?gV@.@..X....
	0x0010:  7f00 0001 0cea 970c 60f3 4019 b337 a59b  ........`.@..7..
	0x0020:  8018 015e fe33 0000 0101 080a b6ec 0458  ...^.3.........X
	0x0030:  b6ec 0458 0700 0002 0000 0002 0000 00    ...X...........
16:53:24.225866 IP instance-1.c.istio-demo-0-2.internal.3307 > demo-vm-1.c.istio-demo-0-2.internal.33684: Flags [P.], seq 111:122, ack 205, win 229, options [nop,nop,TS val 3430511540 ecr 1223657112], length 11
	0x0000:  4500 003f caef 4000 4006 5a8e 0a96 000b  E..?..@.@.Z.....
	0x0010:  0a96 0005 0ceb 8394 1279 9281 6e50 76e0  .........y..nPv.
	0x0020:  8018 00e5 156d 0000 0101 080a cc79 73b4  .....m.......ys.
	0x0030:  48ef 8698 0700 0002 0000 0002 0000 00    H..............
16:53:24.225965 IP demo-vm-1.c.istio-demo-0-2.internal.33684 > instance-1.c.istio-demo-0-2.internal.3307: Flags [P.], seq 205:242, ack 122, win 222, options [nop,nop,TS val 1223657112 ecr 3430511540], length 37
	0x0000:  4508 0059 8e62 4000 4006 96f9 0a96 0005  E..Y.b@.@.......
	0x0010:  0a96 000b 8394 0ceb 6e50 76e0 1279 928c  ........nPv..y..
	0x0020:  8018 00de a860 0000 0101 080a 48ef 8698  .....`......H...
	0x0030:  cc79 73b4 2100 0000 0373 656c 6563 7420  .ys.!....select.
	0x0040:  4040 7665 7273 696f 6e5f 636f 6d6d 656e  @@version_commen
	0x0050:  7420 6c69 6d69 7420 31                   t.limit.1
16:53:24.226099 IP localhost.38668 > localhost.mysql: Flags [P.], seq 205:242, ack 122, win 342, options [nop,nop,TS val 3068920920 ecr 3068920920], length 37
	0x0000:  4500 0059 fc35 4000 4006 4067 7f00 0001  E..Y.5@.@.@g....
	0x0010:  7f00 0001 970c 0cea b337 a59b 60f3 4024  .........7..`.@$
	0x0020:  8018 0156 fe4d 0000 0101 080a b6ec 0458  ...V.M.........X
	0x0030:  b6ec 0458 2100 0000 0373 656c 6563 7420  ...X!....select.
	0x0040:  4040 7665 7273 696f 6e5f 636f 6d6d 656e  @@version_commen
	0x0050:  7420 6c69 6d69 7420 31                   t.limit.1
16:53:24.226424 IP localhost.mysql > localhost.38668: Flags [P.], seq 122:205, ack 242, win 350, options [nop,nop,TS val 3068920920 ecr 3068920920], length 83
	0x0000:  4508 0087 6757 4000 4006 d50f 7f00 0001  E...gW@.@.......
	0x0010:  7f00 0001 0cea 970c 60f3 4024 b337 a5c0  ........`.@$.7..
	0x0020:  8018 015e fe7b 0000 0101 080a b6ec 0458  ...^.{.........X
	0x0030:  b6ec 0458 0100 0001 0127 0000 0203 6465  ...X.....'....de
	0x0040:  6600 0000 1140 4076 6572 7369 6f6e 5f63  f....@@version_c
	0x0050:  6f6d 6d65 6e74 000c 2d00 3000 0000 fd00  omment..-.0.....
	0x0060:  001f 0000 0500 0003 fe00 0002 000d 0000  ................
	0x0070:  040c 5562 756e 7475 2031 362e 3034 0500  ..Ubuntu.16.04..
	0x0080:  0005 fe00 0002 00                        .......
16:53:24.226719 IP instance-1.c.istio-demo-0-2.internal.3307 > demo-vm-1.c.istio-demo-0-2.internal.33684: Flags [P.], seq 122:205, ack 242, win 229, options [nop,nop,TS val 3430511540 ecr 1223657112], length 83
	0x0000:  4500 0087 caf0 4000 4006 5a45 0a96 000b  E.....@.@.ZE....
	0x0010:  0a96 0005 0ceb 8394 1279 928c 6e50 7705  .........y..nPw.
	0x0020:  8018 00e5 15b5 0000 0101 080a cc79 73b4  .............ys.
	0x0030:  48ef 8698 0100 0001 0127 0000 0203 6465  H........'....de
	0x0040:  6600 0000 1140 4076 6572 7369 6f6e 5f63  f....@@version_c
	0x0050:  6f6d 6d65 6e74 000c 2d00 3000 0000 fd00  omment..-.0.....
	0x0060:  001f 0000 0500 0003 fe00 0002 000d 0000  ................
	0x0070:  040c 5562 756e 7475 2031 362e 3034 0500  ..Ubuntu.16.04..
	0x0080:  0005 fe00 0002 00                        .......
16:53:24.226886 IP demo-vm-1.c.istio-demo-0-2.internal.33684 > instance-1.c.istio-demo-0-2.internal.3307: Flags [P.], seq 242:268, ack 205, win 222, options [nop,nop,TS val 1223657112 ecr 3430511540], length 26
	0x0000:  4508 004e 8e63 4000 4006 9703 0a96 0005  E..N.c@.@.......
	0x0010:  0a96 000b 8394 0ceb 6e50 7705 1279 92df  ........nPw..y..
	0x0020:  8018 00de 8a72 0000 0101 080a 48ef 8698  .....r......H...
	0x0030:  cc79 73b4 1600 0000 0373 656c 6563 7420  .ys......select.
	0x0040:  2a20 6672 6f6d 2072 6174 696e 6773       *.from.ratings
16:53:24.227058 IP localhost.38668 > localhost.mysql: Flags [P.], seq 242:268, ack 205, win 342, options [nop,nop,TS val 3068920920 ecr 3068920920], length 26
	0x0000:  4500 004e fc36 4000 4006 4071 7f00 0001  E..N.6@.@.@q....
	0x0010:  7f00 0001 970c 0cea b337 a5c0 60f3 4077  .........7..`.@w
	0x0020:  8018 0156 fe42 0000 0101 080a b6ec 0458  ...V.B.........X
	0x0030:  b6ec 0458 1600 0000 0373 656c 6563 7420  ...X.....select.
	0x0040:  2a20 6672 6f6d 2072 6174 696e 6773       *.from.ratings
16:53:24.227168 IP localhost.mysql > localhost.38668: Flags [P.], seq 205:360, ack 268, win 350, options [nop,nop,TS val 3068920920 ecr 3068920920], length 155
	0x0000:  4508 00cf 6758 4000 4006 d4c6 7f00 0001  E...gX@.@.......
	0x0010:  7f00 0001 0cea 970c 60f3 4077 b337 a5da  ........`.@w.7..
	0x0020:  8018 015e fec3 0000 0101 080a b6ec 0458  ...^...........X
	0x0030:  b6ec 0458 0100 0001 0238 0000 0203 6465  ...X.....8....de
	0x0040:  6604 7465 7374 0772 6174 696e 6773 0772  f.test.ratings.r
	0x0050:  6174 696e 6773 0852 6576 6965 7749 4408  atings.ReviewID.
	0x0060:  5265 7669 6577 4944 0c3f 000b 0000 0003  ReviewID.?......
	0x0070:  0350 0000 0034 0000 0303 6465 6604 7465  .P...4....def.te
	0x0080:  7374 0772 6174 696e 6773 0772 6174 696e  st.ratings.ratin
	0x0090:  6773 0652 6174 696e 6706 5261 7469 6e67  gs.Rating.Rating
	0x00a0:  0c3f 000b 0000 0003 0000 0000 0005 0000  .?..............
	0x00b0:  04fe 0000 2200 0400 0005 0131 0135 0400  ...."......1.5..
	0x00c0:  0006 0132 0134 0500 0007 fe00 0022 00    ...2.4.......".
16:53:24.227446 IP instance-1.c.istio-demo-0-2.internal.3307 > demo-vm-1.c.istio-demo-0-2.internal.33684: Flags [P.], seq 205:360, ack 268, win 229, options [nop,nop,TS val 3430511540 ecr 1223657112], length 155
	0x0000:  4500 00cf caf1 4000 4006 59fc 0a96 000b  E.....@.@.Y.....
	0x0010:  0a96 0005 0ceb 8394 1279 92df 6e50 771f  .........y..nPw.
	0x0020:  8018 00e5 15fd 0000 0101 080a cc79 73b4  .............ys.
	0x0030:  48ef 8698 0100 0001 0238 0000 0203 6465  H........8....de
	0x0040:  6604 7465 7374 0772 6174 696e 6773 0772  f.test.ratings.r
	0x0050:  6174 696e 6773 0852 6576 6965 7749 4408  atings.ReviewID.
	0x0060:  5265 7669 6577 4944 0c3f 000b 0000 0003  ReviewID.?......
	0x0070:  0350 0000 0034 0000 0303 6465 6604 7465  .P...4....def.te
	0x0080:  7374 0772 6174 696e 6773 0772 6174 696e  st.ratings.ratin
	0x0090:  6773 0652 6174 696e 6706 5261 7469 6e67  gs.Rating.Rating
	0x00a0:  0c3f 000b 0000 0003 0000 0000 0005 0000  .?..............
	0x00b0:  04fe 0000 2200 0400 0005 0131 0135 0400  ...."......1.5..
	0x00c0:  0006 0132 0134 0500 0007 fe00 0022 00    ...2.4.......".
16:53:24.227601 IP demo-vm-1.c.istio-demo-0-2.internal.33684 > instance-1.c.istio-demo-0-2.internal.3307: Flags [P.], seq 268:273, ack 360, win 231, options [nop,nop,TS val 1223657112 ecr 3430511540], length 5
	0x0000:  4508 0039 8e64 4000 4006 9717 0a96 0005  E..9.d@.@.......
	0x0010:  0a96 000b 8394 0ceb 6e50 771f 1279 937a  ........nPw..y.z
	0x0020:  8018 00e7 32f5 0000 0101 080a 48ef 8698  ....2.......H...
	0x0030:  cc79 73b4 0100 0000 01                   .ys......
16:53:24.227616 IP demo-vm-1.c.istio-demo-0-2.internal.33684 > instance-1.c.istio-demo-0-2.internal.3307: Flags [F.], seq 273, ack 360, win 231, options [nop,nop,TS val 1223657112 ecr 3430511540], length 0
	0x0000:  4508 0034 8e65 4000 4006 971b 0a96 0005  E..4.e@.@.......
	0x0010:  0a96 000b 8394 0ceb 6e50 7724 1279 937a  ........nPw$.y.z
	0x0020:  8011 00e7 34fc 0000 0101 080a 48ef 8698  ....4.......H...
	0x0030:  cc79 73b4                                .ys.
16:53:24.227951 IP localhost.38668 > localhost.mysql: Flags [P.], seq 268:273, ack 360, win 350, options [nop,nop,TS val 3068920920 ecr 3068920920], length 5
	0x0000:  4500 0039 fc37 4000 4006 4085 7f00 0001  E..9.7@.@.@.....
	0x0010:  7f00 0001 970c 0cea b337 a5da 60f3 4112  .........7..`.A.
	0x0020:  8018 015e fe2d 0000 0101 080a b6ec 0458  ...^.-.........X
	0x0030:  b6ec 0458 0100 0000 01                   ...X.....
16:53:24.227997 IP localhost.mysql > localhost.38668: Flags [F.], seq 360, ack 273, win 350, options [nop,nop,TS val 3068920920 ecr 3068920920], length 0
	0x0000:  4508 0034 6759 4000 4006 d560 7f00 0001  E..4gY@.@..`....
	0x0010:  7f00 0001 0cea 970c 60f3 4112 b337 a5df  ........`.A..7..
	0x0020:  8011 015e fe28 0000 0101 080a b6ec 0458  ...^.(.........X
	0x0030:  b6ec 0458                                ...X
16:53:24.228334 IP localhost.38668 > localhost.mysql: Flags [F.], seq 273, ack 361, win 350, options [nop,nop,TS val 3068920920 ecr 3068920920], length 0
	0x0000:  4500 0034 fc38 4000 4006 4089 7f00 0001  E..4.8@.@.@.....
	0x0010:  7f00 0001 970c 0cea b337 a5df 60f3 4113  .........7..`.A.
	0x0020:  8011 015e fe28 0000 0101 080a b6ec 0458  ...^.(.........X
	0x0030:  b6ec 0458                                ...X
16:53:24.228348 IP localhost.mysql > localhost.38668: Flags [.], ack 274, win 350, options [nop,nop,TS val 3068920920 ecr 3068920920], length 0
	0x0000:  4508 0034 675a 4000 4006 d55f 7f00 0001  E..4gZ@.@.._....
	0x0010:  7f00 0001 0cea 970c 60f3 4113 b337 a5e0  ........`.A..7..
	0x0020:  8010 015e fe28 0000 0101 080a b6ec 0458  ...^.(.........X
	0x0030:  b6ec 0458                                ...X
16:53:24.228584 IP instance-1.c.istio-demo-0-2.internal.3307 > demo-vm-1.c.istio-demo-0-2.internal.33684: Flags [F.], seq 360, ack 274, win 229, options [nop,nop,TS val 3430511541 ecr 1223657112], length 0
	0x0000:  4500 0034 caf2 4000 4006 5a96 0a96 000b  E..4..@.@.Z.....
	0x0010:  0a96 0005 0ceb 8394 1279 937a 6e50 7725  .........y.znPw%
	0x0020:  8011 00e5 1562 0000 0101 080a cc79 73b5  .....b.......ys.
	0x0030:  48ef 8698                                H...
16:53:24.228672 IP demo-vm-1.c.istio-demo-0-2.internal.33684 > instance-1.c.istio-demo-0-2.internal.3307: Flags [.], ack 361, win 231, options [nop,nop,TS val 1223657113 ecr 3430511541], length 0
	0x0000:  4508 0034 8e66 4000 4006 971a 0a96 0005  E..4.f@.@.......
	0x0010:  0a96 000b 8394 0ceb 6e50 7725 1279 937b  ........nPw%.y.{
	0x0020:  8010 00e7 34f9 0000 0101 080a 48ef 8699  ....4.......H...
	0x0030:  cc79 73b5                                .ys.
```

Not working case:
```
16:56:25.165914 IP demo-vm-1.c.istio-demo-0-2.internal.33020 > instance-1.c.istio-demo-0-2.internal.mysql: Flags [S], seq 1360494085, win 28400, options [mss 1420,sackOK,TS val 1223702347 ecr 0,nop,wscale 7], length 0
	0x0000:  4500 003c d707 4000 4006 4e79 0a96 0005  E..<..@.@.Ny....
	0x0010:  0a96 000b 80fc 0cea 5117 7e05 0000 0000  ........Q.~.....
	0x0020:  a002 6ef0 e6bd 0000 0204 058c 0402 080a  ..n.............
	0x0030:  48f0 374b 0000 0000 0103 0307            H.7K........
16:56:25.165956 IP instance-1.c.istio-demo-0-2.internal.mysql > demo-vm-1.c.istio-demo-0-2.internal.33020: Flags [S.], seq 1522706506, ack 1360494086, win 28160, options [mss 1420,sackOK,TS val 3430556775 ecr 1223702347,nop,wscale 7], length 0
	0x0000:  4500 003c 0000 4000 4006 2581 0a96 000b  E..<..@.@.%.....
	0x0010:  0a96 0005 0cea 80fc 5ac2 a84a 5117 7e06  ........Z..JQ.~.
	0x0020:  a012 6e00 156a 0000 0204 058c 0402 080a  ..n..j..........
	0x0030:  cc7a 2467 48f0 374b 0103 0307            .z$gH.7K....
16:56:25.166437 IP demo-vm-1.c.istio-demo-0-2.internal.33020 > instance-1.c.istio-demo-0-2.internal.mysql: Flags [.], ack 1, win 222, options [nop,nop,TS val 1223702347 ecr 3430556775], length 0
	0x0000:  4500 0034 d708 4000 4006 4e80 0a96 0005  E..4..@.@.N.....
	0x0010:  0a96 000b 80fc 0cea 5117 7e06 5ac2 a84b  ........Q.~.Z..K
	0x0020:  8010 00de 8f74 0000 0101 080a 48f0 374b  .....t......H.7K
	0x0030:  cc7a 2467                                .z$g
16:56:25.166984 IP instance-1.c.istio-demo-0-2.internal.39670 > 10.150.0.9.9091: Flags [P.], seq 494:725, ack 126, win 222, options [nop,nop,TS val 569359670 ecr 748357355], length 231
	0x0000:  4500 011b 4e5e 4000 4006 d63f 0a96 000b  E...N^@.@..?....
	0x0010:  0a96 0009 9af6 2383 8461 5741 c37a c313  ......#..aWA.z..
	0x0020:  8018 00de 164d 0000 0101 080a 21ef bd36  .....M......!..6
	0x0030:  2c9b 06eb 0000 1e01 0400 0000 0983 0494  ,...............
	0x0040:  60c8 498e bd26 f25b 17ee 15f4 1bc9 6c62  `.I..&.[......lb
	0x0050:  f4e5 275f c386 c2c1 c0bf be00 00b7 0001  ..'_............
	0x0060:  0000 0009 0000 0000 b20a 8501 0a1e 6d79  ..............my
	0x0070:  7371 6c69 6e76 6d2e 766d 2e73 7663 2e63  sqlinvm.vm.svc.c
	0x0080:  6c75 7374 6572 2e6c 6f63 616c 0a1e 6b75  luster.local..ku
	0x0090:  6265 726e 6574 6573 3a2f 2f76 6d2d 322d  bernetes://vm-2-
	0x00a0:  6d79 7371 6c69 6e76 6d2e 766d 1205 08b4  mysqlinvm.vm....
	0x00b0:  0210 0312 0608 8602 10f8 0112 0508 b002  ................
	0x00c0:  1001 1a06 0802 10fc 8102 3210 088a 0212  ..........2.....
	0x00d0:  0b08 b98f 9ecf 0510 e9dc b64f 4208 0800  ...........OB...
	0x00e0:  1204 0a96 0005 4209 08ac 0212 040a 9600  ......B.........
	0x00f0:  0b10 9f01 1a25 3361 6436 3337 3062 2d61  .....%3ad6370b-a
	0x0100:  3535 342d 3430 3531 2d38 6164 652d 3936  554-4051-8ade-96
	0x0110:  3966 3363 6263 6261 6137 32              9f3cbcbaa72
16:56:25.170918 IP 10.150.0.9.9091 > instance-1.c.istio-demo-0-2.internal.39670: Flags [P.], seq 126:137, ack 725, win 262, options [nop,nop,TS val 748613928 ecr 569359670], length 11
	0x0000:  4500 003f fd84 4000 3e06 29f5 0a96 0009  E..?..@.>.).....
	0x0010:  0a96 000b 2383 9af6 c37a c313 8461 5828  ....#....z...aX(
	0x0020:  8018 0106 725c 0000 0101 080a 2c9e f128  ....r\......,..(
	0x0030:  21ef bd36 0000 0201 0400 0000 0988 c0    !..6...........
16:56:25.170939 IP 10.150.0.9.9091 > instance-1.c.istio-demo-0-2.internal.39670: Flags [P.], seq 137:204, ack 725, win 262, options [nop,nop,TS val 748613928 ecr 569359670], length 67
	0x0000:  4500 0077 fd85 4000 3e06 29bc 0a96 0009  E..w..@.>.).....
	0x0010:  0a96 000b 2383 9af6 c37a c31e 8461 5828  ....#....z...aX(
	0x0020:  8018 0106 b130 0000 0101 080a 2c9e f128  .....0......,..(
	0x0030:  21ef bd36 0000 3a00 0000 0000 0900 0000  !..6..:.........
	0x0040:  0035 1233 0a00 1202 080a 18c8 0122 002a  .5.3.........".*
	0x0050:  2612 0508 b402 1002 1205 08b0 0210 0212  &...............
	0x0060:  0210 0212 0508 ac02 1002 1205 0886 0210  ................
	0x0070:  0212 0408 0610 01                        .......
16:56:25.170943 IP 10.150.0.9.9091 > instance-1.c.istio-demo-0-2.internal.39670: Flags [P.], seq 204:215, ack 725, win 262, options [nop,nop,TS val 748613928 ecr 569359670], length 11
	0x0000:  4500 003f fd86 4000 3e06 29f3 0a96 0009  E..?..@.>.).....
	0x0010:  0a96 000b 2383 9af6 c37a c361 8461 5828  ....#....z.a.aX(
	0x0020:  8018 0106 72d7 0000 0101 080a 2c9e f128  ....r.......,..(
	0x0030:  21ef bd36 0000 0201 0500 0000 09bf be    !..6...........
16:56:25.171517 IP localhost.38684 > localhost.mysql: Flags [S], seq 2673435332, win 43690, options [mss 65495,sackOK,TS val 3068966156 ecr 0,nop,wscale 7], length 0
	0x0000:  4500 003c 6b70 4000 4006 d149 7f00 0001  E..<kp@.@..I....
	0x0010:  7f00 0001 971c 0cea 9f59 62c4 0000 0000  .........Yb.....
	0x0020:  a002 aaaa fe30 0000 0204 ffd7 0402 080a  .....0..........
	0x0030:  b6ec b50c 0000 0000 0103 0307            ............
16:56:25.171527 IP localhost.mysql > localhost.38684: Flags [S.], seq 339641805, ack 2673435333, win 43690, options [mss 65495,sackOK,TS val 3068966156 ecr 3068966156,nop,wscale 7], length 0
	0x0000:  4500 003c 0000 4000 4006 3cba 7f00 0001  E..<..@.@.<.....
	0x0010:  7f00 0001 0cea 971c 143e 85cd 9f59 62c5  .........>...Yb.
	0x0020:  a012 aaaa fe30 0000 0204 ffd7 0402 080a  .....0..........
	0x0030:  b6ec b50c b6ec b50c 0103 0307            ............
16:56:25.171537 IP localhost.38684 > localhost.mysql: Flags [.], ack 1, win 342, options [nop,nop,TS val 3068966156 ecr 3068966156], length 0
	0x0000:  4500 0034 6b71 4000 4006 d150 7f00 0001  E..4kq@.@..P....
	0x0010:  7f00 0001 971c 0cea 9f59 62c5 143e 85ce  .........Yb..>..
	0x0020:  8010 0156 fe28 0000 0101 080a b6ec b50c  ...V.(..........
	0x0030:  b6ec b50c                                ....
16:56:25.171233 IP instance-1.c.istio-demo-0-2.internal.39670 > 10.150.0.9.9091: Flags [.], ack 215, win 222, options [nop,nop,TS val 569359671 ecr 748613928], length 0
	0x0000:  4500 0034 4e5f 4000 4006 d725 0a96 000b  E..4N_@.@..%....
	0x0010:  0a96 0009 9af6 2383 8461 5828 c37a c36c  ......#..aX(.z.l
	0x0020:  8010 00de 1566 0000 0101 080a 21ef bd37  .....f......!..7
	0x0030:  2c9e f128                                ,..(
16:56:25.171842 IP localhost.38684 > localhost.mysql: Flags [.], ack 111, win 342, options [nop,nop,TS val 3068966156 ecr 3068966156], length 0
	0x0000:  4500 0034 6b72 4000 4006 d14f 7f00 0001  E..4kr@.@..O....
	0x0010:  7f00 0001 971c 0cea 9f59 62c5 143e 863c  .........Yb..>.<
	0x0020:  8010 0156 fe28 0000 0101 080a b6ec b50c  ...V.(..........
	0x0030:  b6ec b50c                                ....

<pause>

16:56:35.181882 IP localhost.mysql > localhost.38684: Flags [F.], seq 111, ack 1, win 342, options [nop,nop,TS val 3068968659 ecr 3068966156], length 0
16:56:35.182428 IP instance-1.c.istio-demo-0-2.internal.mysql > demo-vm-1.c.istio-demo-0-2.internal.33020: Flags [P.], seq 1:111, ack 1, win 220, options [nop,nop,TS val 3430559279 ecr 1223702347], length 110
	0x0000:  4500 00a2 a1f8 4000 4006 8322 0a96 000b  E.....@.@.."....
	0x0010:  0a96 0005 0cea 80fc 5ac2 a84b 5117 7e06  ........Z..KQ.~.
	0x0020:  8018 00dc 15d0 0000 0101 080a cc7a 2e2f  .............z./
	0x0030:  48f0 374b 6a00 0000 0a35 2e35 2e35 2d31  H.7Kj....5.5.5-1
	0x0040:  302e 302e 3331 2d4d 6172 6961 4442 2d30  0.0.31-MariaDB-0
	0x0050:  7562 756e 7475 302e 3136 2e30 342e 3200  ubuntu0.16.04.2.
	0x0060:  1300 0000 4529 3927 524a 5e76 00ff f72d  ....E)9'RJ^v...-
	0x0000:  4508 0034 8c7b 4000 4006 b03e 7f00 0001  E..4.{@.@..>....
	0x0010:  7f00 0001 0cea 971c 143e 863c 9f59 62c5  .........>.<.Yb.
	0x0070:  0200 3fa0 1500 0000 0000 0000 0000 0057  ..?............W
	0x0020:  8011 0156 fe28 0000 0101 080a b6ec bed3  ...V.(..........
	0x0080:  312c 2b30 4f7e 4c41 4266 5c00 6d79 7371  1,+0O~LABf\.mysq
	0x0090:  6c5f 6e61 7469 7665 5f70 6173 7377 6f72  l_native_passwor
	0x0030:  b6ec b50c                                ....
16:56:35.182331 IP localhost.38684 > localhost.mysql: Flags [F.], seq 1, ack 112, win 342, options [nop,nop,TS val 3068968659 ecr 3068968659], length 0
	0x00a0:  6400                                     d.
16:56:35.182445 IP instance-1.c.istio-demo-0-2.internal.mysql > demo-vm-1.c.istio-demo-0-2.internal.33020: Flags [F.], seq 111, ack 1, win 220, options [nop,nop,TS val 3430559279 ecr 1223702347], length 0
	0x0000:  4500 0034 6b73 4000 4006 d14e 7f00 0001  E..4ks@.@..N....
	0x0010:  7f00 0001 971c 0cea 9f59 62c5 143e 863d  .........Yb..>.=
	0x0000:  4500 0034 a1f9 4000 4006 838f 0a96 000b  E..4..@.@.......
	0x0010:  0a96 0005 0cea 80fc 5ac2 a8b9 5117 7e06  ........Z...Q.~.
	0x0020:  8011 00dc 1562 0000 0101 080a cc7a 2e2f  .....b.......z./
	0x0020:  8011 0156 fe28 0000 0101 080a b6ec bed3  ...V.(..........
	0x0030:  b6ec bed3                                ....
	0x0030:  48f0 374b                                H.7K
16:56:35.182355 IP localhost.mysql > localhost.38684: Flags [.], ack 2, win 342, options [nop,nop,TS val 3068968659 ecr 3068968659], length 0
	0x0000:  4508 0034 8c7c 4000 4006 b03d 7f00 0001  E..4.|@.@..=....
	0x0010:  7f00 0001 0cea 971c 143e 863d 9f59 62c6  .........>.=.Yb.
	0x0020:  8010 0156 fe28 0000 0101 080a b6ec bed3  ...V.(..........
	0x0030:  b6ec bed3                                ....
16:56:35.183956 IP demo-vm-1.c.istio-demo-0-2.internal.33020 > instance-1.c.istio-demo-0-2.internal.mysql: Flags [.], ack 111, win 222, options [nop,nop,TS val 1223704851 ecr 3430559279], length 0
	0x0000:  4500 0034 d709 4000 4006 4e7f 0a96 0005  E..4..@.@.N.....
	0x0010:  0a96 000b 80fc 0cea 5117 7e06 5ac2 a8b9  ........Q.~.Z...
	0x0020:  8010 00de 7b76 0000 0101 080a 48f0 4113  ....{v......H.A.
	0x0030:  cc7a 2e2f                                .z./
16:56:35.184035 IP demo-vm-1.c.istio-demo-0-2.internal.33020 > instance-1.c.istio-demo-0-2.internal.mysql: Flags [F.], seq 1, ack 112, win 222, options [nop,nop,TS val 1223704851 ecr 3430559279], length 0
	0x0000:  4500 0034 d70a 4000 4006 4e7e 0a96 0005  E..4..@.@.N~....
	0x0010:  0a96 000b 80fc 0cea 5117 7e06 5ac2 a8ba  ........Q.~.Z...
	0x0020:  8011 00de 7b74 0000 0101 080a 48f0 4113  ....{t......H.A.
	0x0030:  cc7a 2e2f                                .z./
16:56:35.184049 IP instance-1.c.istio-demo-0-2.internal.mysql > demo-vm-1.c.istio-demo-0-2.internal.33020: Flags [.], ack 2, win 220, options [nop,nop,TS val 3430559279 ecr 1223704851], length 0
	0x0000:  4500 0034 a1fa 4000 4006 838e 0a96 000b  E..4..@.@.......
	0x0010:  0a96 0005 0cea 80fc 5ac2 a8ba 5117 7e07  ........Z...Q.~.
	0x0020:  8010 00dc 1562 0000 0101 080a cc7a 2e2f  .....b.......z./
	0x0030:  48f0 4113                                H.A.
16:56:36.186147 IP instance-1.c.istio-demo-0-2.internal.39670 > 10.150.0.9.9091: Flags [P.], seq 725:986, ack 215, win 222, options [nop,nop,TS val 569362425 ecr 748613928], length 261
	0x0000:  4500 0139 4e60 4000 4006 d61f 0a96 000b  E..9N`@.@.......
	0x0010:  0a96 0009 9af6 2383 8461 5828 c37a c36c  ......#..aX(.z.l
	0x0020:  8018 00de 166b 0000 0101 080a 21ef c7f9  .....k......!...
	0x0030:  2c9e f128 0000 1e01 0400 0000 0b83 0494  ,..(............
	0x0040:  60c8 498e bd26 f25b 17ee 15f4 1bc9 6c63  `.I..&.[......lc
	0x0050:  696b 3d89 c386 c2c1 c0bf be00 00d5 0001  ik=.............
	0x0060:  0000 000b 0000 0000 d00a 7d12 0508 b402  ..........}.....
	0x0070:  1005 1206 0886 0210 f801 1205 08b0 0210  ................
	0x0080:  031a 0608 ae02 10ea 191a 0508 fc01 1000  ................
	0x0090:  1a04 0801 1000 1a05 08fe 0110 001a 0508  ................
	0x00a0:  8002 106e 1a05 0882 0210 6e1a 0608 0210  ...n......n.....
	0x00b0:  fc81 0232 1008 8a02 120b 08c3 8f9e cf05  ...2............
	0x00c0:  10bc ab82 573a 0c08 8402 1207 080a 10f8  ....W:..........
	0x00d0:  f0ca 0742 0908 ac02 1204 7f00 0001 4208  ...B..........B.
	0x00e0:  0800 1204 0a96 0005 120c 6368 6563 6b2e  ..........check.
	0x00f0:  7374 6174 7573 121e 6d79 7371 6c69 6e76  status..mysqlinv
	0x0100:  6d2e 766d 2e73 7663 2e63 6c75 7374 6572  m.vm.svc.cluster
	0x0110:  2e6c 6f63 616c 121e 6b75 6265 726e 6574  .local..kubernet
	0x0120:  6573 3a2f 2f76 6d2d 322d 6d79 7371 6c69  es://vm-2-mysqli
	0x0130:  6e76 6d2e 766d 189f 01                   nvm.vm...
16:56:36.192103 IP 10.150.0.9.9091 > instance-1.c.istio-demo-0-2.internal.39670: Flags [P.], seq 215:226, ack 986, win 271, options [nop,nop,TS val 748624949 ecr 569362425], length 11
	0x0000:  4500 003f fd87 4000 3e06 29f2 0a96 0009  E..?..@.>.).....
	0x0010:  0a96 000b 2383 9af6 c37a c36c 8461 592d  ....#....z.l.aY-
	0x0020:  8018 010f 3925 0000 0101 080a 2c9f 1c35  ....9%......,..5
	0x0030:  21ef c7f9 0000 0201 0400 0000 0b88 c0    !..............
16:56:36.192198 IP 10.150.0.9.9091 > instance-1.c.istio-demo-0-2.internal.39670: Flags [P.], seq 226:240, ack 986, win 271, options [nop,nop,TS val 748624949 ecr 569362425], length 14
	0x0000:  4500 0042 fd88 4000 3e06 29ee 0a96 0009  E..B..@.>.).....
	0x0010:  0a96 000b 2383 9af6 c37a c377 8461 592d  ....#....z.w.aY-
	0x0020:  8018 010f faa0 0000 0101 080a 2c9f 1c35  ............,..5
	0x0030:  21ef c7f9 0000 0500 0000 0000 0b00 0000  !...............
	0x0040:  0000                                     ..
16:56:36.192205 IP 10.150.0.9.9091 > instance-1.c.istio-demo-0-2.internal.39670: Flags [P.], seq 240:251, ack 986, win 271, options [nop,nop,TS val 748624949 ecr 569362425], length 11
	0x0000:  4500 003f fd89 4000 3e06 29f0 0a96 0009  E..?..@.>.).....
	0x0010:  0a96 000b 2383 9af6 c37a c385 8461 592d  ....#....z...aY-
	0x0020:  8018 010f 39d5 0000 0101 080a 2c9f 1c35  ....9.......,..5
	0x0030:  21ef c7f9 0000 0201 0500 0000 0bbf be    !..............
16:56:36.192466 IP instance-1.c.istio-demo-0-2.internal.39670 > 10.150.0.9.9091: Flags [.], ack 251, win 222, options [nop,nop,TS val 569362426 ecr 748624949], length 0
	0x0000:  4500 0034 4e61 4000 4006 d723 0a96 000b  E..4Na@.@..#....
	0x0010:  0a96 0009 9af6 2383 8461 592d c37a c390  ......#..aY-.z..
	0x0020:  8010 00de 1566 0000 0101 080a 21ef c7fa  .....f......!...
	0x0030:  2c9f 1c35                                ,..5
```

ps output of the 2 tcp dump can be interleaved
```
[1]-  Running                 sudo tcpdump -i lo -s0 -Xx not port 53 &
[2]+  Running                 sudo tcpdump -s0 -Xx not port 53 and not port 22 and not host istio-pilot and not host metadata.google.internal &
```

**Comment by ldemailly** [comment]
client side dump (not same time but exact same results) https://gist.github.com/ldemailly/6c8b06d10ff2d5329597a7b20e5de913

**Comment by ldemailly** [comment]
in case it matters, iptables setup (this is from https://istio.io/docs/setup/kubernetes/mesh-expansion.html and install/tools/setupMeshEx.sh machineSetup VM_NAME
```
ldemailly@instance-1:~$ sudo iptables-save
# Generated by iptables-save v1.6.0 on Wed Oct 18 18:24:10 2017
*nat
:PREROUTING ACCEPT [5:304]
:INPUT ACCEPT [10:604]
:OUTPUT ACCEPT [11616:895200]
:POSTROUTING ACCEPT [11616:895200]
:ISTIO_INBOUND - [0:0]
:ISTIO_OUTPUT - [0:0]
:ISTIO_REDIRECT - [0:0]
-A PREROUTING -p tcp -j ISTIO_INBOUND
-A OUTPUT -p tcp -j ISTIO_OUTPUT
-A ISTIO_INBOUND -p tcp -m tcp --dport 22 -j RETURN
-A ISTIO_INBOUND -p tcp -m tcp --dport 3306 -j ISTIO_REDIRECT
-A ISTIO_OUTPUT ! -d 127.0.0.1/32 -o lo -j ISTIO_REDIRECT
-A ISTIO_OUTPUT -m owner --uid-owner 114 -j RETURN
-A ISTIO_OUTPUT -m owner --uid-owner 0 -j RETURN
-A ISTIO_OUTPUT -d 127.0.0.1/32 -j RETURN
-A ISTIO_OUTPUT -d 10.63.240.0/20 -j ISTIO_REDIRECT
-A ISTIO_OUTPUT -j RETURN
-A ISTIO_REDIRECT -p tcp -j REDIRECT --to-ports 15001
COMMIT
# Completed on Wed Oct 18 18:24:10 2017
# Generated by iptables-save v1.6.0 on Wed Oct 18 18:24:10 2017
*filter
:INPUT ACCEPT [303745:350150168]
:FORWARD ACCEPT [0:0]
:OUTPUT ACCEPT [473828:76366389]
COMMIT
# Completed on Wed Oct 18 18:24:10 2017
ldemailly@instance-1:~$ grep 114 /etc/passwd
istio-proxy:x:114:118::/var/lib/istio:/bin/false
ldemailly@instance-1:~$ ps aux | grep envoy
istio-p+  6301  7.7  0.7  61484 29812 ?        Sl   18:14   0:48 /usr/local/bin/envoy -c /etc/istio/proxy/envoy-rev3.json --restart-epoch 3 --drain-time-s 2 --parent-shutdown-time-s 3 --service-cluster mysqlinvm --service-node sidecar~10.150.0.11~vm-2-mysqlinvm.vm~vm.svc.cluster.local
```

**Comment by ldemailly** [comment]
without tls:

registration:
```
$ curl "istio-pilot:8080/v1/registration/mysqlinvm.vm.svc.cluster.local|mysql"
{
  "hosts": [
   {
    "ip_address": "10.150.0.11",
    "port": 3306
   }
  ]
 }
```
clusters:
```
$ curl istio-pilot:8080/v1/clusters/mysqlinvm/sidecar~10.150.0.11~vm-2-mysqlinvm.vm~vm.svc.cluster.local
{
  "clusters": [
   {
    "name": "in.3306",
    "connect_timeout_ms": 1000,
    "type": "static",
    "lb_type": "round_robin",
    "hosts": [
     {
      "url": "tcp://127.0.0.1:3306"
     }
    ]
   },
   {
    "name": "out.09cf08f72cba01c88169b6031cdd1afa736669dd",
    "service_name": "mysqldb.bookinfo.svc.cluster.local|mysql",
    "connect_timeout_ms": 1000,
    "type": "sds",
    "lb_type": "round_robin"
   },
   {
    "name": "out.12fbbe5aeca76f91137deb89da58adb98726cf90",
    "service_name": "productpage.bookinfo.svc.cluster.local|http",
    "connect_timeout_ms": 1000,
    "type": "sds",
    "lb_type": "round_robin"
   },
   {
    "name": "out.161cbbe815cf026a8e73553810a4a4cd187ed853",
    "service_name": "echosrv.fortio.svc.cluster.local|grpc-ping",
    "connect_timeout_ms": 1000,
    "type": "sds",
    "lb_type": "round_robin",
    "features": "http2"
   },
   {
    "name": "out.161fce79762c0ef0995e61e5615d7f748178a9d0",
    "service_name": "mixer-ilb.istio-system.svc.cluster.local",
    "connect_timeout_ms": 1000,
    "type": "sds",
    "lb_type": "round_robin"
   },
   {
    "name": "out.1681df4675df882eaf09e408b6aa025936554d31",
    "service_name": "istio-mixer.istio-system.svc.cluster.local|configapi",
    "connect_timeout_ms": 1000,
    "type": "sds",
    "lb_type": "round_robin"
   },
   {
    "name": "out.16945bf355e267b93666b8261f51cbd174e79c5b",
    "service_name": "grafana.istio-system.svc.cluster.local|http",
    "connect_timeout_ms": 1000,
    "type": "sds",
    "lb_type": "round_robin"
   },
   {
    "name": "out.1f1ef24e946aeba8865724ba7ecaa0c6ad4274ad",
    "service_name": "istio-mixer.istio-system.svc.cluster.local|prometheus",
    "connect_timeout_ms": 1000,
    "type": "sds",
    "lb_type": "round_robin"
   },
   {
    "name": "out.232bcd00fd4f182aa3c6db69cc967f58f9bd594a",
    "service_name": "istio-pilot.istio-system.svc.cluster.local|http-discovery",
    "connect_timeout_ms": 1000,
    "type": "sds",
    "lb_type": "round_robin"
   },
   {
    "name": "out.27e2983cd15f7c71974df421de603175a5026c21",
    "service_name": "zipkin.istio-system.svc.cluster.local|http",
    "connect_timeout_ms": 1000,
    "type": "sds",
    "lb_type": "round_robin"
   },
   {
    "name": "out.3edb0077e3c8990e3a8420ba7b722970c0c3718c",
    "service_name": "default-http-backend.kube-system.svc.cluster.local|http",
    "connect_timeout_ms": 1000,
    "type": "sds",
    "lb_type": "round_robin"
   },
   {
    "name": "out.3f70f9234c43ff2aa7e70559726b9c643f1559cb",
    "service_name": "istio-pilot.istio-system.svc.cluster.local|http-admission-webhook",
    "connect_timeout_ms": 1000,
    "type": "sds",
    "lb_type": "round_robin"
   },
   {
    "name": "out.4bcf4bbef6bc74ebcc7153f8c1f38dedc246aafd",
    "service_name": "reviews.bookinfo.svc.cluster.local|http|version=v3",
    "connect_timeout_ms": 1000,
    "type": "sds",
    "lb_type": "round_robin"
   },
   {
    "name": "out.4d5691d420d2311622e416c7ba493898eedabfa0",
    "service_name": "istio-pilot-ilb.istio-system.svc.cluster.local",
    "connect_timeout_ms": 1000,
    "type": "sds",
    "lb_type": "round_robin"
   },
   {
    "name": "out.560f4b837a8479916314dbd05a4fc826f79b2b49",
    "service_name": "mysqldb.vm.svc.cluster.local|mysql",
    "connect_timeout_ms": 1000,
    "type": "sds",
    "lb_type": "round_robin"
   },
   {
    "name": "out.5b59344689182358800ea7d1cca7db71eb6627be",
    "service_name": "istio-mixer.istio-system.svc.cluster.local|http-health",
    "connect_timeout_ms": 1000,
    "type": "sds",
    "lb_type": "round_robin"
   },
   {
    "name": "out.5cb271c99221b503a041b8546a7e984dd03016c8",
    "service_name": "istio-ca-ilb.istio-system.svc.cluster.local",
    "connect_timeout_ms": 1000,
    "type": "sds",
    "lb_type": "round_robin"
   },
   {
    "name": "out.5d7642638571c77f9db9761bfa8b485f3693d28c",
    "service_name": "mysqlclient-istio.fortio.svc.cluster.local|mysql",
    "connect_timeout_ms": 1000,
    "type": "sds",
    "lb_type": "round_robin"
   },
   {
    "name": "out.63bcd85452fc2d4ff30fb33a2f42563c3957119c",
    "service_name": "istio-mixer.istio-system.svc.cluster.local|statsd-prom",
    "connect_timeout_ms": 1000,
    "type": "sds",
    "lb_type": "round_robin"
   },
   {
    "name": "out.64a5722ae8d6cfbb7c8968b6de8ce26c7c7dd032",
    "service_name": "kubernetes.default.svc.cluster.local|https",
    "connect_timeout_ms": 1000,
    "type": "sds",
    "lb_type": "round_robin"
   },
   {
    "name": "out.666d5021f5e9ec0d3b17c438c586682ced3bdcec",
    "service_name": "istio-mixer.istio-system.svc.cluster.local|tcp",
    "connect_timeout_ms": 1000,
    "type": "sds",
    "lb_type": "round_robin"
   },
   {
    "name": "out.86b1238e6caaa5f51be1496dff9c5ceccbca49cb",
    "service_name": "details.bookinfo.svc.cluster.local|http",
    "connect_timeout_ms": 1000,
    "type": "sds",
    "lb_type": "round_robin"
   },
   {
    "name": "out.a0df20f10f49b49cc105c7765241c62dd20cc7bc",
    "service_name": "istio-ingress.istio-system.svc.cluster.local|http",
    "connect_timeout_ms": 1000,
    "type": "sds",
    "lb_type": "round_robin"
   },
   {
    "name": "out.b987e2ad2764776fe2084a8604950a29deb2f35c",
    "service_name": "ratings.bookinfo.svc.cluster.local|http|version=v2-mysql",
    "connect_timeout_ms": 1000,
    "type": "sds",
    "lb_type": "round_robin"
   },
   {
    "name": "out.be393c4ba1d093b85e01bb8746397446a6433097",
    "service_name": "echosrv.fortio.svc.cluster.local|http-echo",
    "connect_timeout_ms": 1000,
    "type": "sds",
    "lb_type": "round_robin"
   },
   {
    "name": "out.bffcf45bb7cf7eacfc01ecd666ddac27979567c5",
    "service_name": "kubernetes-dashboard.kube-system.svc.cluster.local",
    "connect_timeout_ms": 1000,
    "type": "sds",
    "lb_type": "round_robin"
   },
   {
    "name": "out.c0f95ba3fe36498f5bb923b846d1610a5c81b889",
    "service_name": "mysqlinvm.vm.svc.cluster.local|mysql",
    "connect_timeout_ms": 1000,
    "type": "sds",
    "lb_type": "round_robin"
   },
   {
    "name": "out.cfe54b2001de4acc9648464a43172895cfe23801",
    "service_name": "fortio1.vm.svc.cluster.local|http",
    "connect_timeout_ms": 1000,
    "type": "sds",
    "lb_type": "round_robin"
   },
   {
    "name": "out.d36cae7561add372bbf7e7a4d2a004cde6987d6d",
    "service_name": "istio-egress.istio-system.svc.cluster.local",
    "connect_timeout_ms": 1000,
    "type": "sds",
    "lb_type": "round_robin"
   },
   {
    "name": "out.ee87a67beba702e80085fe6805feae78fa5a178a",
    "service_name": "prometheus.istio-system.svc.cluster.local|prometheus",
    "connect_timeout_ms": 1000,
    "type": "sds",
    "lb_type": "round_robin"
   },
   {
    "name": "out.f4edaeaa7ddfb6463066fba08871238077692b33",
    "service_name": "heapster.kube-system.svc.cluster.local",
    "connect_timeout_ms": 1000,
    "type": "sds",
    "lb_type": "round_robin"
   },
   {
    "name": "out.f8623c41b5eb88a22366307b5bf7722b8d1d67c6",
    "service_name": "kube-dns.kube-system.svc.cluster.local|dns-tcp",
    "connect_timeout_ms": 1000,
    "type": "sds",
    "lb_type": "round_robin"
   },
   {
    "name": "out.fa1590d71a1526d71ac2ae219451b01a879a2f48",
    "service_name": "istio-ingress.istio-system.svc.cluster.local|https",
    "connect_timeout_ms": 1000,
    "type": "sds",
    "lb_type": "round_robin"
   },
   {
    "name": "mixer_server",
    "connect_timeout_ms": 1000,
    "type": "strict_dns",
    "lb_type": "round_robin",
    "hosts": [
     {
      "url": "tcp://istio-mixer.istio-system:9091"
     }
    ],
    "features": "http2",
    "circuit_breakers": {
     "default": {
      "max_pending_requests": 10000,
      "max_requests": 10000
     }
    }
   }
  ]
 }
```
listeners:
```
$ curl istio-pilot:8080/v1/listeners/mysqlinvm/sidecar~10.150.0.11~vm-2-mysqlinvm.vm~vm.svc.cluster.local
{
  "listeners": [
   {
    "address": "tcp://0.0.0.0:15001",
    "name": "virtual",
    "filters": [],
    "bind_to_port": true,
    "use_original_dst": true
   },
   {
    "address": "tcp://0.0.0.0:3000",
    "name": "http_0.0.0.0_3000",
    "filters": [
     {
      "type": "read",
      "name": "http_connection_manager",
      "config": {
       "codec_type": "auto",
       "stat_prefix": "http",
       "generate_request_id": true,
       "tracing": {
        "operation_name": "egress"
       },
       "rds": {
        "cluster": "rds",
        "route_config_name": "3000",
        "refresh_delay_ms": 1000
       },
       "filters": [
        {
         "type": "decoder",
         "name": "mixer",
         "config": {
          "mixer_attributes": {
           "destination.ip": "10.150.0.11",
           "destination.service": "mysqlinvm.vm.svc.cluster.local",
           "destination.uid": "kubernetes://vm-2-mysqlinvm.vm"
          },
          "forward_attributes": {
           "source.ip": "10.150.0.11",
           "source.uid": "kubernetes://vm-2-mysqlinvm.vm"
          },
          "quota_name": "RequestCount"
         }
        },
        {
         "type": "decoder",
         "name": "router",
         "config": {}
        }
       ],
       "access_log": [
        {
         "path": "/dev/stdout"
        }
       ]
      }
     }
    ],
    "bind_to_port": false
   },
   {
    "address": "tcp://0.0.0.0:443",
    "name": "http_0.0.0.0_443",
    "filters": [
     {
      "type": "read",
      "name": "http_connection_manager",
      "config": {
       "codec_type": "auto",
       "stat_prefix": "http",
       "generate_request_id": true,
       "tracing": {
        "operation_name": "egress"
       },
       "rds": {
        "cluster": "rds",
        "route_config_name": "443",
        "refresh_delay_ms": 1000
       },
       "filters": [
        {
         "type": "decoder",
         "name": "mixer",
         "config": {
          "mixer_attributes": {
           "destination.ip": "10.150.0.11",
           "destination.service": "mysqlinvm.vm.svc.cluster.local",
           "destination.uid": "kubernetes://vm-2-mysqlinvm.vm"
          },
          "forward_attributes": {
           "source.ip": "10.150.0.11",
           "source.uid": "kubernetes://vm-2-mysqlinvm.vm"
          },
          "quota_name": "RequestCount"
         }
        },
        {
         "type": "decoder",
         "name": "router",
         "config": {}
        }
       ],
       "access_log": [
        {
         "path": "/dev/stdout"
        }
       ]
      }
     }
    ],
    "bind_to_port": false
   },
   {
    "address": "tcp://0.0.0.0:80",
    "name": "http_0.0.0.0_80",
    "filters": [
     {
      "type": "read",
      "name": "http_connection_manager",
      "config": {
       "codec_type": "auto",
       "stat_prefix": "http",
       "generate_request_id": true,
       "tracing": {
        "operation_name": "egress"
       },
       "rds": {
        "cluster": "rds",
        "route_config_name": "80",
        "refresh_delay_ms": 1000
       },
       "filters": [
        {
         "type": "decoder",
         "name": "mixer",
         "config": {
          "mixer_attributes": {
           "destination.ip": "10.150.0.11",
           "destination.service": "mysqlinvm.vm.svc.cluster.local",
           "destination.uid": "kubernetes://vm-2-mysqlinvm.vm"
          },
          "forward_attributes": {
           "source.ip": "10.150.0.11",
           "source.uid": "kubernetes://vm-2-mysqlinvm.vm"
          },
          "quota_name": "RequestCount"
         }
        },
        {
         "type": "decoder",
         "name": "router",
         "config": {}
        }
       ],
       "access_log": [
        {
         "path": "/dev/stdout"
        }
       ]
      }
     }
    ],
    "bind_to_port": false
   },
   {
    "address": "tcp://0.0.0.0:8079",
    "name": "http_0.0.0.0_8079",
    "filters": [
     {
      "type": "read",
      "name": "http_connection_manager",
      "config": {
       "codec_type": "auto",
       "stat_prefix": "http",
       "generate_request_id": true,
       "tracing": {
        "operation_name": "egress"
       },
       "rds": {
        "cluster": "rds",
        "route_config_name": "8079",
        "refresh_delay_ms": 1000
       },
       "filters": [
        {
         "type": "decoder",
         "name": "mixer",
         "config": {
          "mixer_attributes": {
           "destination.ip": "10.150.0.11",
           "destination.service": "mysqlinvm.vm.svc.cluster.local",
           "destination.uid": "kubernetes://vm-2-mysqlinvm.vm"
          },
          "forward_attributes": {
           "source.ip": "10.150.0.11",
           "source.uid": "kubernetes://vm-2-mysqlinvm.vm"
          },
          "quota_name": "RequestCount"
         }
        },
        {
         "type": "decoder",
         "name": "router",
         "config": {}
        }
       ],
       "access_log": [
        {
         "path": "/dev/stdout"
        }
       ]
      }
     }
    ],
    "bind_to_port": false
   },
   {
    "address": "tcp://0.0.0.0:8080",
    "name": "http_0.0.0.0_8080",
    "filters": [
     {
      "type": "read",
      "name": "http_connection_manager",
      "config": {
       "codec_type": "auto",
       "stat_prefix": "http",
       "generate_request_id": true,
       "tracing": {
        "operation_name": "egress"
       },
       "rds": {
        "cluster": "rds",
        "route_config_name": "8080",
        "refresh_delay_ms": 1000
       },
       "filters": [
        {
         "type": "decoder",
         "name": "mixer",
         "config": {
          "mixer_attributes": {
           "destination.ip": "10.150.0.11",
           "destination.service": "mysqlinvm.vm.svc.cluster.local",
           "destination.uid": "kubernetes://vm-2-mysqlinvm.vm"
          },
          "forward_attributes": {
           "source.ip": "10.150.0.11",
           "source.uid": "kubernetes://vm-2-mysqlinvm.vm"
          },
          "quota_name": "RequestCount"
         }
        },
        {
         "type": "decoder",
         "name": "router",
         "config": {}
        }
       ],
       "access_log": [
        {
         "path": "/dev/stdout"
        }
       ]
      }
     }
    ],
    "bind_to_port": false
   },
   {
    "address": "tcp://0.0.0.0:9080",
    "name": "http_0.0.0.0_9080",
    "filters": [
     {
      "type": "read",
      "name": "http_connection_manager",
      "config": {
       "codec_type": "auto",
       "stat_prefix": "http",
       "generate_request_id": true,
       "tracing": {
        "operation_name": "egress"
       },
       "rds": {
        "cluster": "rds",
        "route_config_name": "9080",
        "refresh_delay_ms": 1000
       },
       "filters": [
        {
         "type": "decoder",
         "name": "mixer",
         "config": {
          "mixer_attributes": {
           "destination.ip": "10.150.0.11",
           "destination.service": "mysqlinvm.vm.svc.cluster.local",
           "destination.uid": "kubernetes://vm-2-mysqlinvm.vm"
          },
          "forward_attributes": {
           "source.ip": "10.150.0.11",
           "source.uid": "kubernetes://vm-2-mysqlinvm.vm"
          },
          "quota_name": "RequestCount"
         }
        },
        {
         "type": "decoder",
         "name": "router",
         "config": {}
        }
       ],
       "access_log": [
        {
         "path": "/dev/stdout"
        }
       ]
      }
     }
    ],
    "bind_to_port": false
   },
   {
    "address": "tcp://0.0.0.0:9093",
    "name": "http_0.0.0.0_9093",
    "filters": [
     {
      "type": "read",
      "name": "http_connection_manager",
      "config": {
       "codec_type": "auto",
       "stat_prefix": "http",
       "generate_request_id": true,
       "tracing": {
        "operation_name": "egress"
       },
       "rds": {
        "cluster": "rds",
        "route_config_name": "9093",
        "refresh_delay_ms": 1000
       },
       "filters": [
        {
         "type": "decoder",
         "name": "mixer",
         "config": {
          "mixer_attributes": {
           "destination.ip": "10.150.0.11",
           "destination.service": "mysqlinvm.vm.svc.cluster.local",
           "destination.uid": "kubernetes://vm-2-mysqlinvm.vm"
          },
          "forward_attributes": {
           "source.ip": "10.150.0.11",
           "source.uid": "kubernetes://vm-2-mysqlinvm.vm"
          },
          "quota_name": "RequestCount"
         }
        },
        {
         "type": "decoder",
         "name": "router",
         "config": {}
        }
       ],
       "access_log": [
        {
         "path": "/dev/stdout"
        }
       ]
      }
     }
    ],
    "bind_to_port": false
   },
   {
    "address": "tcp://0.0.0.0:9411",
    "name": "http_0.0.0.0_9411",
    "filters": [
     {
      "type": "read",
      "name": "http_connection_manager",
      "config": {
       "codec_type": "auto",
       "stat_prefix": "http",
       "generate_request_id": true,
       "tracing": {
        "operation_name": "egress"
       },
       "rds": {
        "cluster": "rds",
        "route_config_name": "9411",
        "refresh_delay_ms": 1000
       },
       "filters": [
        {
         "type": "decoder",
         "name": "mixer",
         "config": {
          "mixer_attributes": {
           "destination.ip": "10.150.0.11",
           "destination.service": "mysqlinvm.vm.svc.cluster.local",
           "destination.uid": "kubernetes://vm-2-mysqlinvm.vm"
          },
          "forward_attributes": {
           "source.ip": "10.150.0.11",
           "source.uid": "kubernetes://vm-2-mysqlinvm.vm"
          },
          "quota_name": "RequestCount"
         }
        },
        {
         "type": "decoder",
         "name": "router",
         "config": {}
        }
       ],
       "access_log": [
        {
         "path": "/dev/stdout"
        }
       ]
      }
     }
    ],
    "bind_to_port": false
   },
   {
    "address": "tcp://10.150.0.11:3306",
    "name": "tcp_10.150.0.11_3306",
    "filters": [
     {
      "type": "both",
      "name": "mixer",
      "config": {
       "mixer_attributes": {
        "destination.ip": "10.150.0.11",
        "destination.service": "mysqlinvm.vm.svc.cluster.local",
        "destination.uid": "kubernetes://vm-2-mysqlinvm.vm"
       }
      }
     },
     {
      "type": "read",
      "name": "tcp_proxy",
      "config": {
       "stat_prefix": "tcp",
       "route_config": {
        "routes": [
         {
          "cluster": "in.3306",
          "destination_ip_list": [
           "10.150.0.11/32"
          ]
         }
        ]
       }
      }
     }
    ],
    "bind_to_port": false
   },
   {
    "address": "tcp://10.63.240.10:53",
    "name": "tcp_10.63.240.10_53",
    "filters": [
     {
      "type": "read",
      "name": "tcp_proxy",
      "config": {
       "stat_prefix": "tcp",
       "route_config": {
        "routes": [
         {
          "cluster": "out.f8623c41b5eb88a22366307b5bf7722b8d1d67c6",
          "destination_ip_list": [
           "10.63.240.10/32"
          ]
         }
        ]
       }
      }
     }
    ],
    "bind_to_port": false
   },
   {
    "address": "tcp://10.63.240.194:80",
    "name": "tcp_10.63.240.194_80",
    "filters": [
     {
      "type": "read",
      "name": "tcp_proxy",
      "config": {
       "stat_prefix": "tcp",
       "route_config": {
        "routes": [
         {
          "cluster": "out.d36cae7561add372bbf7e7a4d2a004cde6987d6d",
          "destination_ip_list": [
           "10.63.240.194/32"
          ]
         }
        ]
       }
      }
     }
    ],
    "bind_to_port": false
   },
   {
    "address": "tcp://10.63.240.1:443",
    "name": "tcp_10.63.240.1_443",
    "filters": [
     {
      "type": "read",
      "name": "tcp_proxy",
      "config": {
       "stat_prefix": "tcp",
       "route_config": {
        "routes": [
         {
          "cluster": "out.64a5722ae8d6cfbb7c8968b6de8ce26c7c7dd032",
          "destination_ip_list": [
           "10.63.240.1/32"
          ]
         }
        ]
       }
      }
     }
    ],
    "bind_to_port": false
   },
   {
    "address": "tcp://10.63.242.120:80",
    "name": "tcp_10.63.242.120_80",
    "filters": [
     {
      "type": "read",
      "name": "tcp_proxy",
      "config": {
       "stat_prefix": "tcp",
       "route_config": {
        "routes": [
         {
          "cluster": "out.bffcf45bb7cf7eacfc01ecd666ddac27979567c5",
          "destination_ip_list": [
           "10.63.242.120/32"
          ]
         }
        ]
       }
      }
     }
    ],
    "bind_to_port": false
   },
   {
    "address": "tcp://10.63.245.111:443",
    "name": "tcp_10.63.245.111_443",
    "filters": [
     {
      "type": "read",
      "name": "tcp_proxy",
      "config": {
       "stat_prefix": "tcp",
       "route_config": {
        "routes": [
         {
          "cluster": "out.fa1590d71a1526d71ac2ae219451b01a879a2f48",
          "destination_ip_list": [
           "10.63.245.111/32"
          ]
         }
        ]
       }
      }
     }
    ],
    "bind_to_port": false
   },
   {
    "address": "tcp://10.63.246.69:8060",
    "name": "tcp_10.63.246.69_8060",
    "filters": [
     {
      "type": "read",
      "name": "tcp_proxy",
      "config": {
       "stat_prefix": "tcp",
       "route_config": {
        "routes": [
         {
          "cluster": "out.5cb271c99221b503a041b8546a7e984dd03016c8",
          "destination_ip_list": [
           "10.63.246.69/32"
          ]
         }
        ]
       }
      }
     }
    ],
    "bind_to_port": false
   },
   {
    "address": "tcp://10.63.247.21:3306",
    "name": "tcp_10.63.247.21_3306",
    "filters": [
     {
      "type": "read",
      "name": "tcp_proxy",
      "config": {
       "stat_prefix": "tcp",
       "route_config": {
        "routes": [
         {
          "cluster": "out.09cf08f72cba01c88169b6031cdd1afa736669dd",
          "destination_ip_list": [
           "10.63.247.21/32"
          ]
         }
        ]
       }
      }
     }
    ],
    "bind_to_port": false
   },
   {
    "address": "tcp://10.63.247.51:80",
    "name": "tcp_10.63.247.51_80",
    "filters": [
     {
      "type": "read",
      "name": "tcp_proxy",
      "config": {
       "stat_prefix": "tcp",
       "route_config": {
        "routes": [
         {
          "cluster": "out.f4edaeaa7ddfb6463066fba08871238077692b33",
          "destination_ip_list": [
           "10.63.247.51/32"
          ]
         }
        ]
       }
      }
     }
    ],
    "bind_to_port": false
   },
   {
    "address": "tcp://10.63.247.93:3306",
    "name": "tcp_10.63.247.93_3306",
    "filters": [
     {
      "type": "read",
      "name": "tcp_proxy",
      "config": {
       "stat_prefix": "tcp",
       "route_config": {
        "routes": [
         {
          "cluster": "out.c0f95ba3fe36498f5bb923b846d1610a5c81b889",
          "destination_ip_list": [
           "10.63.247.93/32"
          ]
         }
        ]
       }
      }
     }
    ],
    "bind_to_port": false
   },
   {
    "address": "tcp://10.63.249.141:9091",
    "name": "tcp_10.63.249.141_9091",
    "filters": [
     {
      "type": "read",
      "name": "tcp_proxy",
      "config": {
       "stat_prefix": "tcp",
       "route_config": {
        "routes": [
         {
          "cluster": "out.161fce79762c0ef0995e61e5615d7f748178a9d0",
          "destination_ip_list": [
           "10.63.249.141/32"
          ]
         }
        ]
       }
      }
     }
    ],
    "bind_to_port": false
   },
   {
    "address": "tcp://10.63.249.158:3306",
    "name": "tcp_10.63.249.158_3306",
    "filters": [
     {
      "type": "read",
      "name": "tcp_proxy",
      "config": {
       "stat_prefix": "tcp",
       "route_config": {
        "routes": [
         {
          "cluster": "out.5d7642638571c77f9db9761bfa8b485f3693d28c",
          "destination_ip_list": [
           "10.63.249.158/32"
          ]
         }
        ]
       }
      }
     }
    ],
    "bind_to_port": false
   },
   {
    "address": "tcp://10.63.252.229:3306",
    "name": "tcp_10.63.252.229_3306",
    "filters": [
     {
      "type": "read",
      "name": "tcp_proxy",
      "config": {
       "stat_prefix": "tcp",
       "route_config": {
        "routes": [
         {
          "cluster": "out.560f4b837a8479916314dbd05a4fc826f79b2b49",
          "destination_ip_list": [
           "10.63.252.229/32"
          ]
         }
        ]
       }
      }
     }
    ],
    "bind_to_port": false
   },
   {
    "address": "tcp://10.63.254.187:8080",
    "name": "tcp_10.63.254.187_8080",
    "filters": [
     {
      "type": "read",
      "name": "tcp_proxy",
      "config": {
       "stat_prefix": "tcp",
       "route_config": {
        "routes": [
         {
          "cluster": "out.4d5691d420d2311622e416c7ba493898eedabfa0",
          "destination_ip_list": [
           "10.63.254.187/32"
          ]
         }
        ]
       }
      }
     }
    ],
    "bind_to_port": false
   },
   {
    "address": "tcp://10.63.254.56:9090",
    "name": "tcp_10.63.254.56_9090",
    "filters": [
     {
      "type": "read",
      "name": "tcp_proxy",
      "config": {
       "stat_prefix": "tcp",
       "route_config": {
        "routes": [
         {
          "cluster": "out.ee87a67beba702e80085fe6805feae78fa5a178a",
          "destination_ip_list": [
           "10.63.254.56/32"
          ]
         }
        ]
       }
      }
     }
    ],
    "bind_to_port": false
   },
   {
    "address": "tcp://10.63.255.165:42422",
    "name": "tcp_10.63.255.165_42422",
    "filters": [
     {
      "type": "read",
      "name": "tcp_proxy",
      "config": {
       "stat_prefix": "tcp",
       "route_config": {
        "routes": [
         {
          "cluster": "out.1f1ef24e946aeba8865724ba7ecaa0c6ad4274ad",
          "destination_ip_list": [
           "10.63.255.165/32"
          ]
         }
        ]
       }
      }
     }
    ],
    "bind_to_port": false
   },
   {
    "address": "tcp://10.63.255.165:9091",
    "name": "tcp_10.63.255.165_9091",
    "filters": [
     {
      "type": "read",
      "name": "tcp_proxy",
      "config": {
       "stat_prefix": "tcp",
       "route_config": {
        "routes": [
         {
          "cluster": "out.666d5021f5e9ec0d3b17c438c586682ced3bdcec",
          "destination_ip_list": [
           "10.63.255.165/32"
          ]
         }
        ]
       }
      }
     }
    ],
    "bind_to_port": false
   },
   {
    "address": "tcp://10.63.255.165:9094",
    "name": "tcp_10.63.255.165_9094",
    "filters": [
     {
      "type": "read",
      "name": "tcp_proxy",
      "config": {
       "stat_prefix": "tcp",
       "route_config": {
        "routes": [
         {
          "cluster": "out.1681df4675df882eaf09e408b6aa025936554d31",
          "destination_ip_list": [
           "10.63.255.165/32"
          ]
         }
        ]
       }
      }
     }
    ],
    "bind_to_port": false
   },
   {
    "address": "tcp://10.63.255.165:9102",
    "name": "tcp_10.63.255.165_9102",
    "filters": [
     {
      "type": "read",
      "name": "tcp_proxy",
      "config": {
       "stat_prefix": "tcp",
       "route_config": {
        "routes": [
         {
          "cluster": "out.63bcd85452fc2d4ff30fb33a2f42563c3957119c",
          "destination_ip_list": [
           "10.63.255.165/32"
          ]
         }
        ]
       }
      }
     }
    ],
    "bind_to_port": false
   }
  ]
 }
```

**Comment by PiotrSikora** [comment]
FWIW, I cannot replicate this locally, with:

    client --TCP--> envoy #1 --mTLS--> envoy #2 --TCP--> backend
                            \         /
                             \       /
                               mixer

where:
- client is `nc -v 127.0.0.1 <port>`
- backend is `(echo THIS_IS_ME; sleep 20; echo PACKET_2) | nc -v -l <port>`

but it's possible that my mixer is misconfigured.

**Comment by ldemailly** [comment]
thanks a lot for having tried. strange. can you try using iptables and clusterip instead of 127.0.0.1 for the client
(so it goes client-> clusterip:3306 -> localhost:15001 -> server:3306 -> envoy:15001 -> localhost:3306 )
(with mixer and tls; also do it more than once)

**Comment by lizan** [comment]
Fixed.
https://github.com/istio/proxy/pull/604
https://github.com/istio/proxy/pull/597
